{
  "schema_version": "1.0",
  "slide_id": "S01",
  "base_art": {"path": "episodes/E001/art/S01.png", "sha256": "5eddf660f986a23106893ab1dc35389f527db7e294f79084b61643cc9c3d0e54"},
  "canvas": {"width": 1080, "height": 1350},
  "font": {"path": "assets/fonts/NotoSansKR-Regular.woff2", "sha256": "d1bf8649914a4fe9477a8735bf056383e44e466141fb3d61897252e06d900c1a"},
  "elements": [
    {
      "id": "caption_1", "role": "CAPTION", "text": "한 시간 기다려서 겨우 받음",
      "box": {"x": 40, "y": 45, "width": 590, "height": 125},
      "align": "center", "font_size": 44, "fill": "#111111",
      "bubble": {"fill": "#FFFFFF", "outline": "#111111", "outline_width": 4, "radius": 30, "padding": 22}
    }
  ]
}
